<?xml version="1.0" encoding="UTF-8" ?>
<!--
Documento  : tickets.xml
Creado     : 16/10/08 09:27 AM
Autor      : nombre_autor
Descripcion: Archivo generado por plantilla de la Libreria SAFET
-->

<!--<!DOCTYPE yawl SYSTEM "http://trac-safet.cenditel.gob.ve/dtd/yawlworkflow.dtd">-->
<!DOCTYPE yawl SYSTEM "file:///home/vbravo/PySafet/yawlworkflow.dtd">
<yawl  version="0.01">
<workflow id="Viaticos" desc="Flujo de planillas de viaticos">
	<token key="viaticos.id"  keysource="viaticos">
	</token>
<condition id="inicial" type="start">
                <port side="forward" type="split"   >
                        <connection   source="Solicitado" query="select status from personal"  options="solicitado" tokenlink="[cedula,cedulaviajero:viaticos]">
			</connection>
		</port>
	</condition>
	<task id="Solicitado"  title="en_evaluacion" >
                <port side="forward" type="split"   >
                        <connection source="Director" query="VariableSolicitado SIGN Antonio Araujo Brett;Victor Bravo" options="" tokenlink="[cedula,cedulaviajero:viaticos]">
			</connection>
</port>
		<variable id="VariableSolicitado" scope="task"  type="sql" config="1"   tokenlink="[cedula,cedulaviajero:viaticos]" documentsource="select id,nombres,apellidos,horasalida,horallegada,proyecto,ciudad from personal" >
		</variable>
	</task>
	<task id="Director"  title="aaraujo" >
                <port side="forward" type="split" >
                        <connection source="Presupuesto" query="VariableSolicitado SIGN Victor Bravo,Antonio Araujo Brett" options="" tokenlink="[cedula,cedulaviajero:viaticos]">
			</connection>
		</port>
		<variable id="VariableDirector" scope="task"  type="sql" config="1"   tokenlink="[cedula,cedulaviajero:viaticos]" documentsource="select id,cedula,nombres,apellidos,horasalida,horallegada,proyecto,ciudad,fechasolicitud,fechadirector,fechadirector-fechasolicitud as Espera from personal" >
		</variable>
<autofilter id="PorEmpleado" type="split" source="Presupuesto" query="select cedulaviajero from viaticos" tokenlink="[cedula,cedulaviajero:viaticos]" report="yes"> 
</autofilter>
	</task>
	<task id="Presupuesto"  title="vbravo" >
                <port side="forward" type="split" >
                        <connection source="Presidente" query="VariableSolicitado SIGN Victor Bravo,Antonio Araujo Brett,Leandro Leon" options="" tokenlink="[cedula,cedulaviajero:viaticos]">
			</connection>
		</port>
		<variable id="VariablePresupuesto" scope="task"  type="sql" config="1"   tokenlink="[cedula,cedulaviajero:viaticos]" documentsource="select id,cedula,nombres,apellidos,horasalida,horallegada,proyecto,ciudad,fechadirector,fechapresupuesto,fechapresupuesto-fechadirector as Espera from personal" >
		</variable>
	</task>
	<task id="Presidente"  title="lleon" >
                <port side="forward" type="split" >
                        <connection source="final" query="true" options="" >
			</connection>
		</port>
		<variable id="VariablePresidente" scope="task"  type="sql" config="1"   tokenlink="[cedula,cedulaviajero:viaticos]" documentsource="select id,cedula,nombres,apellidos,horasalida,horallegada,proyecto,ciudad from personal" >
		</variable>
	</task>

	<condition id="final">
		<port side="forward" type="split">
			<connection source="">
			</connection>
		</port>
	</condition>
</workflow>
	<configuration id="1" connectstring="psql:seguridad.cenditel.gob.ve:ticket:vbravo:vbravo_">
	</configuration>
</yawl>
